{"$schema":"https://json-schema.org/draft/2020-12/schema","$id":"https://botnexus.dev/schemas/ui-evidence-1.0.json","title":"BotNexus portal UI evidence","type":"object","additionalProperties":false,"required":["schemaVersion","source","scenario","viewport","screenshot","assertions","accessibility","timestamps","cleanup"],"properties":{"schemaVersion":{"const":"1.0"},"source":{"type":"object","additionalProperties":false,"required":["commit","tree"],"properties":{"commit":{"$ref":"#/$defs/gitObject"},"tree":{"$ref":"#/$defs/sourceTree"}}},"scenario":{"type":"object","additionalProperties":false,"required":["name","promptKey"],"properties":{"name":{"type":"string"},"promptKey":{"enum":["SLOW_STREAM","MATRIX_PRE_TOKEN","MATRIX_TOOL_GAP","MATRIX_LONG_ACTIVE"]},"pagePath":{"type":"string"}}},"viewport":{"type":"object","additionalProperties":false,"required":["width","height"],"properties":{"width":{"type":"integer","minimum":320},"height":{"type":"integer","minimum":320}}},"screenshot":{"type":"object","additionalProperties":false,"required":["path","sha256"],"properties":{"path":{"pattern":"^[A-Za-z0-9._-]+\\.png$"},"sha256":{"pattern":"^[0-9a-f]{64}$"}}},"captures":{"type":"array","minItems":1,"items":{"$ref":"#/$defs/capture"}},"assertions":{"type":"array","minItems":1,"items":{"type":"object","additionalProperties":false,"required":["kind","target","passed","detail"],"properties":{"kind":{"type":"string"},"target":{"type":"string"},"passed":{"const":true},"detail":{"type":"string"}}}},"accessibility":{"type":"object","additionalProperties":false,"required":["activeRunControls"],"properties":{"activeRunControls":{"type":"object","additionalProperties":{"type":"string","minLength":1},"required":["chat-steer-btn","chat-redirect-btn","chat-followup-btn","chat-abort-btn"]}}},"timestamps":{"type":"object","additionalProperties":false,"required":["startedUtc","capturedUtc","completedUtc"],"properties":{"startedUtc":{"$ref":"#/$defs/timestamp"},"capturedUtc":{"$ref":"#/$defs/timestamp"},"completedUtc":{"$ref":"#/$defs/timestamp"}}},"cleanup":{"type":"object","additionalProperties":false,"required":["gatewayStopped","browserClosed","temporaryDataRemoved","containerRemoved"],"properties":{"gatewayStopped":{"const":true},"browserClosed":{"const":true},"temporaryDataRemoved":{"const":true},"containerRemoved":{"const":true}}}},"$defs":{"gitObject":{"type":"string","pattern":"^[0-9a-f]{40}$"},"sourceTree":{"type":"string","pattern":"^[0-9a-f]{64}$"},"timestamp":{"type":"string","format":"date-time"},"capture":{"type":"object","additionalProperties":false,"required":["name","viewport","screenshot","assertions"],"properties":{"name":{"enum":["desktop-idle","mobile-idle","mobile-active","active-pre-token","active-tool-gap","focused-active","reduced-motion","returned-idle","animation-start","animation-midpoint","animation-end"]},"viewport":{"$ref":"#/properties/viewport"},"screenshot":{"$ref":"#/properties/screenshot"},"assertions":{"$ref":"#/properties/assertions"}},"allOf":[{"if":{"properties":{"name":{"enum":["animation-start","animation-midpoint"]}},"required":["name"]},"then":{"properties":{"assertions":{"contains":{"required":["target","passed"],"properties":{"target":{"pattern":"^animation-(start|midpoint):before-offset-distance$"},"passed":{"const":true}}}}}}},{"if":{"properties":{"name":{"const":"mobile-idle"}},"required":["name"]},"then":{"properties":{"assertions":{"allOf":[{"contains":{"required":["target","passed"],"properties":{"target":{"const":"mobile-idle:route"},"passed":{"const":true}}}},{"contains":{"required":["target","passed"],"properties":{"target":{"const":"mobile-idle:composer-selector"},"passed":{"const":true}}}},{"contains":{"required":["target","passed"],"properties":{"target":{"const":"mobile-idle:aria-busy"},"passed":{"const":true}}}},{"contains":{"required":["target","passed"],"properties":{"target":{"const":"mobile-idle:stable-status-absent"},"passed":{"const":true}}}}]}}}},{"if":{"properties":{"name":{"const":"mobile-active"}},"required":["name"]},"then":{"properties":{"assertions":{"allOf":[{"contains":{"required":["target","passed"],"properties":{"target":{"const":"mobile-active:route"},"passed":{"const":true}}}},{"contains":{"required":["target","passed"],"properties":{"target":{"const":"mobile-active:composer-selector"},"passed":{"const":true}}}},{"contains":{"required":["target","passed"],"properties":{"target":{"const":"mobile-active:aria-busy"},"passed":{"const":true}}}},{"contains":{"required":["target","passed"],"properties":{"target":{"const":"mobile-active:stable-status"},"passed":{"const":true}}}}]}}}}]}},"allOf":[{"if":{"required":["captures"]},"then":{"properties":{"assertions":{"contains":{"type":"object","required":["kind","target","passed"],"properties":{"kind":{"const":"browserState"},"target":{"const":"animation:offset-distance-changes"},"passed":{"const":true}}}}}}},{"if":{"required":["captures"]},"then":{"properties":{"captures":{"minItems":11,"maxItems":11,"allOf":[{"contains":{"required":["name"],"properties":{"name":{"const":"desktop-idle"}}}},{"contains":{"required":["name"],"properties":{"name":{"const":"mobile-idle"}}}},{"contains":{"required":["name"],"properties":{"name":{"const":"mobile-active"}}}},{"contains":{"required":["name"],"properties":{"name":{"const":"active-pre-token"}}}},{"contains":{"required":["name"],"properties":{"name":{"const":"active-tool-gap"}}}},{"contains":{"required":["name"],"properties":{"name":{"const":"focused-active"}}}},{"contains":{"required":["name"],"properties":{"name":{"const":"reduced-motion"}}}},{"contains":{"required":["name"],"properties":{"name":{"const":"returned-idle"}}}},{"contains":{"required":["name"],"properties":{"name":{"const":"animation-start"}}}},{"contains":{"required":["name"],"properties":{"name":{"const":"animation-midpoint"}}}},{"contains":{"required":["name"],"properties":{"name":{"const":"animation-end"}}}}]}}}}]}
